{
  "asics": [
    {
      "asic_family": "asic:memory-machine",
      "asic_id": 0,
      "asic_model": "Trident2",
      "hbm_gb": 0.0,
      "memory_tables": [
        "LPM",
        "Host Table",
        "TCAM"
      ],
      "slices": [
        {
          "buffer_mb": 9.0,
          "ifg_count": 0,
          "ifg_serdes": "3 banks x 16x10G = 480G FP bandwidth",
          "ports": [
            {
              "breakout_options": [],
              "connector": "SFP+",
              "end_port": 16,
              "label": "Eth1/1-16 (SFP+ 10G, retimer)",
              "native_speed": "10G",
              "start_port": 1
            },
            {
              "breakout_options": [],
              "connector": "SFP+",
              "end_port": 32,
              "label": "Eth1/17-32 (SFP+ 10G, direct)",
              "native_speed": "10G",
              "start_port": 17
            },
            {
              "breakout_options": [],
              "connector": "SFP+",
              "end_port": 48,
              "label": "Eth1/33-48 (SFP+ 10G, retimer)",
              "native_speed": "10G",
              "start_port": 33
            }
          ],
          "slice_id": 0,
          "tcam_entries": 0
        }
      ],
      "sms_mb": 9.0,
      "total_bandwidth_gbps": 1280.0
    },
    {
      "asic_family": "asic:memory-machine",
      "asic_id": 1,
      "asic_model": "Northstar",
      "hbm_gb": 0.0,
      "memory_tables": [],
      "slices": [
        {
          "buffer_mb": 0.0,
          "ifg_count": 0,
          "ifg_serdes": "12x 40G MACN ports + retimers",
          "ports": [
            {
              "breakout_options": [
                "4x10G"
              ],
              "connector": "QSFP+",
              "end_port": 60,
              "label": "Eth1/49-60 (QSFP+ 40G)",
              "native_speed": "40G",
              "start_port": 49
            }
          ],
          "slice_id": 0,
          "tcam_entries": 0
        }
      ],
      "sms_mb": 0.0,
      "total_bandwidth_gbps": 480.0
    }
  ],
  "chassis_type": "fixed",
  "confidence": "medium",
  "os": "nxos",
  "platform_family": "nexus-9300",
  "platform_id": "n9396px",
  "platform_name": "Nexus 9396PX (Lake Placid)",
  "platform_pid": "N9K-C9396PX",
  "schema_version": "1.0.0",
  "sources": [
    {
      "id": "cisco-hw-n9396px",
      "title": "Tech Zone: Nexus 9k ASIC Mappings, Lake Placid Block Diagram",
      "type": "documentation"
    },
    {
      "id": "cisco:hardware-topology/nexus-9300/n9396px.json",
      "title": "cisco knowledge base — hardware-topology/nexus-9300/n9396px.json",
      "type": "documentation"
    }
  ],
  "total_bandwidth_tbps": 1.44,
  "total_ports": 60
}
