{
  "asics": [
    {
      "asic_family": "asic:adelaide-m2",
      "asic_id": 0,
      "asic_model": "EARL8 (Bremgarten)",
      "hbm_gb": 0.0,
      "memory_tables": [
        "FIB",
        "TCAM",
        "ACL",
        "QoS",
        "NetFlow"
      ],
      "slices": [
        {
          "buffer_mb": 0.0,
          "ifg_count": 0,
          "ifg_serdes": "",
          "ports": [
            {
              "breakout_options": [],
              "connector": "X2",
              "end_port": 4,
              "label": "Eth-slot/1/1-4",
              "native_speed": "10G",
              "start_port": 1
            }
          ],
          "slice_id": 0,
          "tcam_entries": 0
        }
      ],
      "sms_mb": 0.0,
      "total_bandwidth_gbps": 40.0
    },
    {
      "asic_family": "asic:adelaide-m2",
      "asic_id": 1,
      "asic_model": "EARL8 (Bremgarten)",
      "hbm_gb": 0.0,
      "memory_tables": [
        "FIB",
        "TCAM",
        "ACL",
        "QoS",
        "NetFlow"
      ],
      "slices": [
        {
          "buffer_mb": 0.0,
          "ifg_count": 0,
          "ifg_serdes": "",
          "ports": [
            {
              "breakout_options": [],
              "connector": "X2",
              "end_port": 8,
              "label": "Eth-slot/1/5-8",
              "native_speed": "10G",
              "start_port": 5
            }
          ],
          "slice_id": 0,
          "tcam_entries": 0
        }
      ],
      "sms_mb": 0.0,
      "total_bandwidth_gbps": 40.0
    }
  ],
  "confidence": "medium",
  "os": "nxos",
  "platform_family": "nexus-7000",
  "platform_id": "n7k-m108x2-12l",
  "platform_name": "Nexus 7000 M108X2-12L (Adelaide)",
  "platform_pid": "N7K-M108X2-12L",
  "schema_version": "1.0.0",
  "sources": [
    {
      "id": "cisco-hw-n7k-m108x2-12l",
      "title": "Cisco Nexus 7000 M2 (Adelaide) Architecture",
      "type": "documentation"
    },
    {
      "id": "cisco:hardware-topology/nexus-7000/n7k-m108x2-12l.json",
      "title": "cisco knowledge base — hardware-topology/nexus-7000/n7k-m108x2-12l.json",
      "type": "documentation"
    }
  ],
  "total_bandwidth_tbps": 0.08,
  "total_ports": 8
}
