{
  "asics": [
    {
      "asic_family": "asic:silicon-one",
      "asic_id": 0,
      "asic_model": "Q200",
      "hbm_gb": 8.0,
      "memory_tables": [
        "LPM",
        "CEM",
        "HCAM",
        "EM"
      ],
      "slices": [
        {
          "buffer_mb": 0.0,
          "ifg_count": 2,
          "ifg_serdes": "16x100G per IFG",
          "ports": [
            {
              "breakout_options": [
                "4x100G",
                "2x200G",
                "4x100G"
              ],
              "connector": "QSFP-DD",
              "end_port": 8,
              "label": "Eth1/1-8",
              "native_speed": "400G",
              "start_port": 1
            }
          ],
          "slice_id": 0,
          "tcam_entries": 0
        },
        {
          "buffer_mb": 0.0,
          "ifg_count": 2,
          "ifg_serdes": "16x100G per IFG",
          "ports": [
            {
              "breakout_options": [
                "4x100G",
                "2x200G"
              ],
              "connector": "QSFP-DD",
              "end_port": 16,
              "label": "Eth1/9-16",
              "native_speed": "400G",
              "start_port": 9
            }
          ],
          "slice_id": 1,
          "tcam_entries": 0
        },
        {
          "buffer_mb": 0.0,
          "ifg_count": 2,
          "ifg_serdes": "16x100G per IFG",
          "ports": [
            {
              "breakout_options": [
                "4x100G",
                "2x200G"
              ],
              "connector": "QSFP-DD",
              "end_port": 24,
              "label": "Eth1/17-24",
              "native_speed": "400G",
              "start_port": 17
            }
          ],
          "slice_id": 2,
          "tcam_entries": 0
        },
        {
          "buffer_mb": 0.0,
          "ifg_count": 2,
          "ifg_serdes": "16x100G per IFG",
          "ports": [
            {
              "breakout_options": [
                "4x100G",
                "2x200G"
              ],
              "connector": "QSFP-DD",
              "end_port": 32,
              "label": "Eth1/25-32",
              "native_speed": "400G",
              "start_port": 25
            }
          ],
          "slice_id": 3,
          "tcam_entries": 0
        },
        {
          "buffer_mb": 0.0,
          "ifg_count": 2,
          "ifg_serdes": "4x100G per IFG",
          "ports": [
            {
              "breakout_options": [
                "4x100G"
              ],
              "connector": "QSFP-DD",
              "end_port": 34,
              "label": "Eth1/33-34",
              "native_speed": "400G",
              "start_port": 33
            }
          ],
          "slice_id": 4,
          "tcam_entries": 0
        }
      ],
      "sms_mb": 128.0,
      "total_bandwidth_gbps": 12800.0
    }
  ],
  "chassis_type": "fixed",
  "confidence": "medium",
  "os": "nxos",
  "platform_family": "nexus-9300",
  "platform_id": "n9332d-h2r",
  "platform_name": "Nexus 9332D-H2R",
  "platform_pid": "N9K-C9332D-H2R",
  "schema_version": "1.0.0",
  "sources": [
    {
      "id": "cisco-hw-n9332d-h2r",
      "title": "BRKDCN-3063-2024, N9332D-H2R datasheet",
      "type": "documentation"
    },
    {
      "id": "cisco:hardware-topology/nexus-9300/n9332d-h2r.json",
      "title": "cisco knowledge base — hardware-topology/nexus-9300/n9332d-h2r.json",
      "type": "documentation"
    }
  ],
  "total_bandwidth_tbps": 12.8,
  "total_ports": 34
}
