{
  "asics": [
    {
      "asic_family": "asic:silicon-one",
      "asic_id": 0,
      "asic_model": "Q200L",
      "hbm_gb": 0.0,
      "memory_tables": [
        "LPM",
        "CEM",
        "TCAM"
      ],
      "slices": [
        {
          "buffer_mb": 32.0,
          "ifg_count": 2,
          "ifg_serdes": "16x50G per IFG",
          "ports": [
            {
              "breakout_options": [
                "4x25G",
                "4x10G"
              ],
              "connector": "QSFP28",
              "end_port": 18,
              "label": "Eth1/1-18",
              "native_speed": "100G",
              "start_port": 1
            }
          ],
          "slice_id": 0,
          "tcam_entries": 0
        },
        {
          "buffer_mb": 32.0,
          "ifg_count": 2,
          "ifg_serdes": "16x50G per IFG",
          "ports": [
            {
              "breakout_options": [
                "4x25G",
                "4x10G"
              ],
              "connector": "QSFP28",
              "end_port": 36,
              "label": "Eth1/19-36",
              "native_speed": "100G",
              "start_port": 19
            }
          ],
          "slice_id": 1,
          "tcam_entries": 0
        }
      ],
      "sms_mb": 64.0,
      "total_bandwidth_gbps": 6400.0
    }
  ],
  "chassis_type": "fixed",
  "confidence": "medium",
  "os": "nxos",
  "platform_family": "nexus-9300",
  "platform_id": "n9336c-fx2",
  "platform_name": "Nexus 9336C-FX2",
  "platform_pid": "N9K-C9336C-FX2",
  "schema_version": "1.0.0",
  "sources": [
    {
      "id": "cisco-hw-n9336c-fx2",
      "title": "BRKDCN-3063-2024, N9336C-FX2 datasheet",
      "type": "documentation"
    },
    {
      "id": "cisco:hardware-topology/nexus-9300/n9336c-fx2.json",
      "title": "cisco knowledge base — hardware-topology/nexus-9300/n9336c-fx2.json",
      "type": "documentation"
    }
  ],
  "total_bandwidth_tbps": 6.4,
  "total_ports": 36
}
