{
  "asics": [
    {
      "asic_family": "asic:m-series",
      "asic_id": 0,
      "asic_model": "Starlifter",
      "hbm_gb": 0.0,
      "memory_tables": [
        "Algorithmic TCAM",
        "LPM",
        "Host Table"
      ],
      "slices": [
        {
          "buffer_mb": 0.0,
          "ifg_count": 1,
          "ifg_serdes": "6x 40G",
          "ports": [
            {
              "breakout_options": [
                "4x10G"
              ],
              "connector": "QSFP+",
              "end_port": 6,
              "label": "Eth-slot/1/1-6",
              "native_speed": "40G",
              "start_port": 1
            }
          ],
          "slice_id": 0,
          "tcam_entries": 0
        }
      ],
      "sms_mb": 0.0,
      "total_bandwidth_gbps": 240.0
    },
    {
      "asic_family": "asic:m-series",
      "asic_id": 1,
      "asic_model": "Starlifter",
      "hbm_gb": 0.0,
      "memory_tables": [
        "Algorithmic TCAM",
        "LPM",
        "Host Table"
      ],
      "slices": [
        {
          "buffer_mb": 0.0,
          "ifg_count": 1,
          "ifg_serdes": "6x 40G",
          "ports": [
            {
              "breakout_options": [
                "4x10G"
              ],
              "connector": "QSFP+",
              "end_port": 12,
              "label": "Eth-slot/1/7-12",
              "native_speed": "40G",
              "start_port": 7
            }
          ],
          "slice_id": 0,
          "tcam_entries": 0
        }
      ],
      "sms_mb": 0.0,
      "total_bandwidth_gbps": 240.0
    },
    {
      "asic_family": "asic:m-series",
      "asic_id": 2,
      "asic_model": "Starlifter",
      "hbm_gb": 0.0,
      "memory_tables": [
        "Algorithmic TCAM",
        "LPM",
        "Host Table"
      ],
      "slices": [
        {
          "buffer_mb": 0.0,
          "ifg_count": 1,
          "ifg_serdes": "6x 40G",
          "ports": [
            {
              "breakout_options": [
                "4x10G"
              ],
              "connector": "QSFP+",
              "end_port": 18,
              "label": "Eth-slot/1/13-18",
              "native_speed": "40G",
              "start_port": 13
            }
          ],
          "slice_id": 0,
          "tcam_entries": 0
        }
      ],
      "sms_mb": 0.0,
      "total_bandwidth_gbps": 240.0
    },
    {
      "asic_family": "asic:m-series",
      "asic_id": 3,
      "asic_model": "Starlifter",
      "hbm_gb": 0.0,
      "memory_tables": [
        "Algorithmic TCAM",
        "LPM",
        "Host Table"
      ],
      "slices": [
        {
          "buffer_mb": 0.0,
          "ifg_count": 1,
          "ifg_serdes": "6x 40G",
          "ports": [
            {
              "breakout_options": [
                "4x10G"
              ],
              "connector": "QSFP+",
              "end_port": 24,
              "label": "Eth-slot/1/19-24",
              "native_speed": "40G",
              "start_port": 19
            }
          ],
          "slice_id": 0,
          "tcam_entries": 0
        }
      ],
      "sms_mb": 0.0,
      "total_bandwidth_gbps": 240.0
    }
  ],
  "confidence": "medium",
  "os": "nxos",
  "platform_family": "nexus-7700",
  "platform_id": "n77-m324fq-25l",
  "platform_name": "Nexus 7700 N77-M324FQ-25L (CB Brabham 40G)",
  "platform_pid": "N77-M324FQ-25L",
  "schema_version": "1.0.0",
  "sources": [
    {
      "id": "cisco-hw-n77-m324fq-25l",
      "title": "Cisco Tech Zone: N7K ASIC Mappings, CB Brabham 40G diagram",
      "type": "documentation"
    },
    {
      "id": "cisco:hardware-topology/nexus-7000/n77-m324fq-25l.json",
      "title": "cisco knowledge base — hardware-topology/nexus-7000/n77-m324fq-25l.json",
      "type": "documentation"
    }
  ],
  "total_bandwidth_tbps": 0.96,
  "total_ports": 24
}
