{
  "asics": [
    {
      "asic_family": "asic:memory-machine",
      "asic_id": 0,
      "asic_model": "Memory Machine",
      "hbm_gb": 0.0,
      "memory_tables": [
        "LPM",
        "Host Table",
        "TCAM"
      ],
      "slices": [
        {
          "buffer_mb": 9.0,
          "ifg_count": 0,
          "ifg_serdes": "26x Warpcore",
          "ports": [
            {
              "breakout_options": [
                "4x10G"
              ],
              "connector": "QSFP+",
              "end_port": 26,
              "label": "Eth1/1-26 (QSFP+ 40G)",
              "native_speed": "40G",
              "start_port": 1
            }
          ],
          "slice_id": 0,
          "tcam_entries": 0
        }
      ],
      "sms_mb": 9.0,
      "total_bandwidth_gbps": 1280.0
    },
    {
      "asic_family": "asic:memory-machine",
      "asic_id": 1,
      "asic_model": "Donner",
      "hbm_gb": 0.0,
      "memory_tables": [],
      "slices": [
        {
          "buffer_mb": 0.0,
          "ifg_count": 0,
          "ifg_serdes": "8 network ports + 5 fabric ports",
          "ports": [
            {
              "breakout_options": [
                "4x10G"
              ],
              "connector": "QSFP+",
              "end_port": 32,
              "label": "Eth1/27-32 (QSFP+ 40G)",
              "native_speed": "40G",
              "start_port": 27
            }
          ],
          "slice_id": 0,
          "tcam_entries": 0
        }
      ],
      "sms_mb": 0.0,
      "total_bandwidth_gbps": 160.0
    }
  ],
  "chassis_type": "fixed",
  "confidence": "medium",
  "os": "nxos",
  "platform_family": "nexus-9300",
  "platform_id": "n9332pq",
  "platform_name": "Nexus 9332PQ",
  "platform_pid": "N9K-C9332PQ",
  "schema_version": "1.0.0",
  "sources": [
    {
      "id": "cisco-hw-n9332pq",
      "title": "Tech Zone: Nexus 9k ASIC Mappings",
      "type": "documentation"
    },
    {
      "id": "cisco:hardware-topology/nexus-9300/n9332pq.json",
      "title": "cisco knowledge base — hardware-topology/nexus-9300/n9332pq.json",
      "type": "documentation"
    }
  ],
  "total_bandwidth_tbps": 2.56,
  "total_ports": 32
}
