{
  "asics": [
    {
      "asic_family": "asic:memory-machine",
      "asic_id": 0,
      "asic_model": "Blackswift",
      "hbm_gb": 0.0,
      "memory_tables": [
        "TCAM",
        "LPM",
        "Host Table"
      ],
      "slices": [
        {
          "buffer_mb": 0.0,
          "ifg_count": 1,
          "ifg_serdes": "3x 100G",
          "ports": [
            {
              "breakout_options": [
                "4x25G",
                "4x10G"
              ],
              "connector": "QSFP28",
              "end_port": 3,
              "label": "Eth-slot/1/1-3",
              "native_speed": "100G",
              "start_port": 1
            }
          ],
          "slice_id": 0,
          "tcam_entries": 0
        }
      ],
      "sms_mb": 0.0,
      "total_bandwidth_gbps": 300.0
    },
    {
      "asic_family": "asic:memory-machine",
      "asic_id": 1,
      "asic_model": "Blackswift",
      "hbm_gb": 0.0,
      "memory_tables": [
        "TCAM",
        "LPM",
        "Host Table"
      ],
      "slices": [
        {
          "buffer_mb": 0.0,
          "ifg_count": 1,
          "ifg_serdes": "3x 100G",
          "ports": [
            {
              "breakout_options": [
                "4x25G",
                "4x10G"
              ],
              "connector": "QSFP28",
              "end_port": 6,
              "label": "Eth-slot/1/4-6",
              "native_speed": "100G",
              "start_port": 4
            }
          ],
          "slice_id": 0,
          "tcam_entries": 0
        }
      ],
      "sms_mb": 0.0,
      "total_bandwidth_gbps": 300.0
    },
    {
      "asic_family": "asic:memory-machine",
      "asic_id": 2,
      "asic_model": "Blackswift",
      "hbm_gb": 0.0,
      "memory_tables": [
        "TCAM",
        "LPM",
        "Host Table"
      ],
      "slices": [
        {
          "buffer_mb": 0.0,
          "ifg_count": 1,
          "ifg_serdes": "3x 100G",
          "ports": [
            {
              "breakout_options": [
                "4x25G",
                "4x10G"
              ],
              "connector": "QSFP28",
              "end_port": 9,
              "label": "Eth-slot/1/7-9",
              "native_speed": "100G",
              "start_port": 7
            }
          ],
          "slice_id": 0,
          "tcam_entries": 0
        }
      ],
      "sms_mb": 0.0,
      "total_bandwidth_gbps": 300.0
    },
    {
      "asic_family": "asic:memory-machine",
      "asic_id": 3,
      "asic_model": "Blackswift",
      "hbm_gb": 0.0,
      "memory_tables": [
        "TCAM",
        "LPM",
        "Host Table"
      ],
      "slices": [
        {
          "buffer_mb": 0.0,
          "ifg_count": 1,
          "ifg_serdes": "3x 100G",
          "ports": [
            {
              "breakout_options": [
                "4x25G",
                "4x10G"
              ],
              "connector": "QSFP28",
              "end_port": 12,
              "label": "Eth-slot/1/10-12",
              "native_speed": "100G",
              "start_port": 10
            }
          ],
          "slice_id": 0,
          "tcam_entries": 0
        }
      ],
      "sms_mb": 0.0,
      "total_bandwidth_gbps": 300.0
    },
    {
      "asic_family": "asic:memory-machine",
      "asic_id": 4,
      "asic_model": "Blackswift",
      "hbm_gb": 0.0,
      "memory_tables": [
        "TCAM",
        "LPM",
        "Host Table"
      ],
      "slices": [
        {
          "buffer_mb": 0.0,
          "ifg_count": 1,
          "ifg_serdes": "3x 100G",
          "ports": [
            {
              "breakout_options": [
                "4x25G",
                "4x10G"
              ],
              "connector": "QSFP28",
              "end_port": 15,
              "label": "Eth-slot/1/13-15",
              "native_speed": "100G",
              "start_port": 13
            }
          ],
          "slice_id": 0,
          "tcam_entries": 0
        }
      ],
      "sms_mb": 0.0,
      "total_bandwidth_gbps": 300.0
    },
    {
      "asic_family": "asic:memory-machine",
      "asic_id": 5,
      "asic_model": "Blackswift",
      "hbm_gb": 0.0,
      "memory_tables": [
        "TCAM",
        "LPM",
        "Host Table"
      ],
      "slices": [
        {
          "buffer_mb": 0.0,
          "ifg_count": 1,
          "ifg_serdes": "3x 100G",
          "ports": [
            {
              "breakout_options": [
                "4x25G",
                "4x10G"
              ],
              "connector": "QSFP28",
              "end_port": 18,
              "label": "Eth-slot/1/16-18",
              "native_speed": "100G",
              "start_port": 16
            }
          ],
          "slice_id": 0,
          "tcam_entries": 0
        }
      ],
      "sms_mb": 0.0,
      "total_bandwidth_gbps": 300.0
    },
    {
      "asic_family": "asic:memory-machine",
      "asic_id": 6,
      "asic_model": "Blackswift",
      "hbm_gb": 0.0,
      "memory_tables": [
        "TCAM",
        "LPM",
        "Host Table"
      ],
      "slices": [
        {
          "buffer_mb": 0.0,
          "ifg_count": 1,
          "ifg_serdes": "3x 100G",
          "ports": [
            {
              "breakout_options": [
                "4x25G",
                "4x10G"
              ],
              "connector": "QSFP28",
              "end_port": 21,
              "label": "Eth-slot/1/19-21",
              "native_speed": "100G",
              "start_port": 19
            }
          ],
          "slice_id": 0,
          "tcam_entries": 0
        }
      ],
      "sms_mb": 0.0,
      "total_bandwidth_gbps": 300.0
    },
    {
      "asic_family": "asic:memory-machine",
      "asic_id": 7,
      "asic_model": "Blackswift",
      "hbm_gb": 0.0,
      "memory_tables": [
        "TCAM",
        "LPM",
        "Host Table"
      ],
      "slices": [
        {
          "buffer_mb": 0.0,
          "ifg_count": 1,
          "ifg_serdes": "3x 100G",
          "ports": [
            {
              "breakout_options": [
                "4x25G",
                "4x10G"
              ],
              "connector": "QSFP28",
              "end_port": 24,
              "label": "Eth-slot/1/22-24",
              "native_speed": "100G",
              "start_port": 22
            }
          ],
          "slice_id": 0,
          "tcam_entries": 0
        }
      ],
      "sms_mb": 0.0,
      "total_bandwidth_gbps": 300.0
    },
    {
      "asic_family": "asic:memory-machine",
      "asic_id": 8,
      "asic_model": "Blackswift",
      "hbm_gb": 0.0,
      "memory_tables": [
        "TCAM",
        "LPM",
        "Host Table"
      ],
      "slices": [
        {
          "buffer_mb": 0.0,
          "ifg_count": 1,
          "ifg_serdes": "3x 100G",
          "ports": [
            {
              "breakout_options": [
                "4x25G",
                "4x10G"
              ],
              "connector": "QSFP28",
              "end_port": 27,
              "label": "Eth-slot/1/25-27",
              "native_speed": "100G",
              "start_port": 25
            }
          ],
          "slice_id": 0,
          "tcam_entries": 0
        }
      ],
      "sms_mb": 0.0,
      "total_bandwidth_gbps": 300.0
    },
    {
      "asic_family": "asic:memory-machine",
      "asic_id": 9,
      "asic_model": "Blackswift",
      "hbm_gb": 0.0,
      "memory_tables": [
        "TCAM",
        "LPM",
        "Host Table"
      ],
      "slices": [
        {
          "buffer_mb": 0.0,
          "ifg_count": 1,
          "ifg_serdes": "3x 100G",
          "ports": [
            {
              "breakout_options": [
                "4x25G",
                "4x10G"
              ],
              "connector": "QSFP28",
              "end_port": 30,
              "label": "Eth-slot/1/28-30",
              "native_speed": "100G",
              "start_port": 28
            }
          ],
          "slice_id": 0,
          "tcam_entries": 0
        }
      ],
      "sms_mb": 0.0,
      "total_bandwidth_gbps": 300.0
    }
  ],
  "confidence": "medium",
  "os": "nxos",
  "platform_family": "nexus-7700",
  "platform_id": "n77-f430cq-36",
  "platform_name": "Nexus 7700 N77-F430CQ-36 (CB Fangio 100G)",
  "platform_pid": "N77-F430CQ-36",
  "schema_version": "1.0.0",
  "sources": [
    {
      "id": "cisco-hw-n77-f430cq-36",
      "title": "Cisco Tech Zone: N7K ASIC Mappings, CB Fangio diagram",
      "type": "documentation"
    },
    {
      "id": "cisco:hardware-topology/nexus-7000/n77-f430cq-36.json",
      "title": "cisco knowledge base — hardware-topology/nexus-7000/n77-f430cq-36.json",
      "type": "documentation"
    }
  ],
  "total_bandwidth_tbps": 3.0,
  "total_ports": 30
}
